{
  "assessments": [
    {
      "assessment_id": "assess-status-v1",
      "criterion_confidence": {
        "affordability": 0.82,
        "evidence": 0.82,
        "fairness": 0.82,
        "resilience": 0.82,
        "reversibility": 0.82,
        "value": 0.82
      },
      "distributional_scores": {
        "disabled-users": 42,
        "general-users": 52,
        "staff": 62
      },
      "gates": {
        "budget": "pass",
        "legal": "pass",
        "privacy": "pass",
        "safety": "pass"
      },
      "option_id": "opt-status-quo",
      "recorded_at": "2026-05-24T09:00:00Z",
      "scenario_scores": {
        "base": {
          "affordability": 82,
          "evidence": 88,
          "fairness": 52,
          "resilience": 70,
          "reversibility": 95,
          "value": 42
        },
        "disruption": {
          "affordability": 84,
          "evidence": 88,
          "fairness": 50,
          "resilience": 72,
          "reversibility": 95,
          "value": 40
        },
        "downside": {
          "affordability": 85,
          "evidence": 90,
          "fairness": 56,
          "resilience": 76,
          "reversibility": 95,
          "value": 48
        },
        "upside": {
          "affordability": 82,
          "evidence": 85,
          "fairness": 48,
          "resilience": 66,
          "reversibility": 95,
          "value": 36
        }
      },
      "source_ids": [
        "src-service-baseline",
        "src-community-input"
      ],
      "supersedes": null
    },
    {
      "assessment_id": "assess-pilot-v1",
      "criterion_confidence": {
        "affordability": 0.83,
        "evidence": 0.83,
        "fairness": 0.83,
        "resilience": 0.83,
        "reversibility": 0.83,
        "value": 0.83
      },
      "distributional_scores": {
        "disabled-users": 76,
        "general-users": 82,
        "staff": 72
      },
      "gates": {
        "budget": "pass",
        "legal": "pass",
        "privacy": "pass",
        "safety": "pass"
      },
      "option_id": "opt-bounded-pilot",
      "recorded_at": "2026-05-24T09:05:00Z",
      "scenario_scores": {
        "base": {
          "affordability": 68,
          "evidence": 86,
          "fairness": 82,
          "resilience": 84,
          "reversibility": 90,
          "value": 80
        },
        "disruption": {
          "affordability": 50,
          "evidence": 82,
          "fairness": 68,
          "resilience": 70,
          "reversibility": 90,
          "value": 58
        },
        "downside": {
          "affordability": 58,
          "evidence": 88,
          "fairness": 76,
          "resilience": 78,
          "reversibility": 92,
          "value": 68
        },
        "upside": {
          "affordability": 72,
          "evidence": 84,
          "fairness": 86,
          "resilience": 86,
          "reversibility": 90,
          "value": 88
        }
      },
      "source_ids": [
        "src-service-baseline",
        "src-rights-review",
        "src-pilot-eval",
        "src-community-input"
      ],
      "supersedes": null
    },
    {
      "assessment_id": "assess-rollout-v1",
      "criterion_confidence": {
        "affordability": 0.7,
        "evidence": 0.7,
        "fairness": 0.7,
        "resilience": 0.7,
        "reversibility": 0.7,
        "value": 0.7
      },
      "distributional_scores": {
        "disabled-users": 12,
        "general-users": 60,
        "staff": 75
      },
      "gates": {
        "budget": "pass",
        "legal": "fail",
        "privacy": "fail",
        "safety": "fail"
      },
      "option_id": "opt-full-rollout",
      "recorded_at": "2026-05-24T09:10:00Z",
      "scenario_scores": {
        "base": {
          "affordability": 75,
          "evidence": 30,
          "fairness": 28,
          "resilience": 35,
          "reversibility": 10,
          "value": 92
        },
        "disruption": {
          "affordability": 18,
          "evidence": 18,
          "fairness": 8,
          "resilience": 8,
          "reversibility": 3,
          "value": 22
        },
        "downside": {
          "affordability": 30,
          "evidence": 22,
          "fairness": 12,
          "resilience": 15,
          "reversibility": 5,
          "value": 45
        },
        "upside": {
          "affordability": 80,
          "evidence": 32,
          "fairness": 34,
          "resilience": 42,
          "reversibility": 8,
          "value": 96
        }
      },
      "source_ids": [
        "src-rights-review",
        "src-community-input"
      ],
      "supersedes": null
    }
  ],
  "assumptions": [
    {
      "assumption_id": "asm-take-up-v1",
      "confidence": 0.6,
      "dependencies": [],
      "falsifiers": [
        "Observed value leaves the declared range for pilot-take-up."
      ],
      "lineage_id": "pilot-take-up",
      "monitor": {
        "cadence": "monthly",
        "metric": "pilot-take-up",
        "owner": "decision-owner",
        "trigger": "outside declared range"
      },
      "recorded_at": "2026-05-21T10:00:00Z",
      "statement": "Eligible users choosing the pilot channel.",
      "supersedes": null,
      "valid_from": "2026-05-21T10:00:00Z",
      "valid_until": null,
      "value": {
        "base": 0.35,
        "high": 0.55,
        "low": 0.15,
        "unit": "fraction"
      }
    },
    {
      "assumption_id": "asm-review-time-v1",
      "confidence": 0.66,
      "dependencies": [],
      "falsifiers": [
        "Observed value leaves the declared range for review-time."
      ],
      "lineage_id": "review-time",
      "monitor": {
        "cadence": "monthly",
        "metric": "review-time",
        "owner": "decision-owner",
        "trigger": "outside declared range"
      },
      "recorded_at": "2026-05-21T10:10:00Z",
      "statement": "Human review time per assisted case.",
      "supersedes": null,
      "valid_from": "2026-05-21T10:10:00Z",
      "valid_until": null,
      "value": {
        "base": 14,
        "high": 24,
        "low": 8,
        "unit": "minutes"
      }
    }
  ],
  "case_as_of": "2026-09-01T19:00:00Z",
  "case_id": "synthetic-public-service-pilot",
  "claims": [
    {
      "certainty": "confirmed",
      "claim_id": "claim-service-problem",
      "claim_type": "fact",
      "consequence": "high",
      "contradict_source_ids": [],
      "not_proven": [
        "Does not establish performance in a real organization."
      ],
      "qualification_source_ids": [],
      "recorded_at": "2026-05-20T12:00:00Z",
      "scope": "synthetic case only",
      "statement": "The current synthetic service process has a material wait-time problem.",
      "support_source_ids": [
        "src-service-baseline",
        "src-community-input"
      ],
      "used_for_decision": true
    },
    {
      "certainty": "confirmed",
      "claim_id": "claim-bounded-pilot",
      "claim_type": "fact",
      "consequence": "critical",
      "contradict_source_ids": [],
      "not_proven": [
        "Does not prove the pilot is lawful or effective in any real jurisdiction."
      ],
      "qualification_source_ids": [],
      "recorded_at": "2026-05-20T12:10:00Z",
      "scope": "synthetic case only",
      "statement": "A reversible assistance-only pilot can preserve human decision authority.",
      "support_source_ids": [
        "src-rights-review",
        "src-pilot-eval"
      ],
      "used_for_decision": true
    },
    {
      "certainty": "confirmed",
      "claim_id": "claim-full-rollout-risk",
      "claim_type": "fact",
      "consequence": "critical",
      "contradict_source_ids": [],
      "not_proven": [
        "Does not establish performance in a real organization."
      ],
      "qualification_source_ids": [],
      "recorded_at": "2026-05-20T12:20:00Z",
      "scope": "synthetic case only",
      "statement": "Full automation would exceed the synthetic rights and evidence boundary.",
      "support_source_ids": [
        "src-rights-review",
        "src-community-input"
      ],
      "used_for_decision": true
    },
    {
      "certainty": "confirmed",
      "claim_id": "claim-pilot-outcome",
      "claim_type": "fact",
      "consequence": "medium",
      "contradict_source_ids": [],
      "not_proven": [
        "Does not establish performance in a real organization."
      ],
      "qualification_source_ids": [],
      "recorded_at": "2026-08-26T12:00:00Z",
      "scope": "synthetic case only",
      "statement": "Later synthetic outcome evidence shows lower wait time under the bounded pilot.",
      "support_source_ids": [
        "src-pilot-outcome"
      ],
      "used_for_decision": false
    }
  ],
  "decision": {
    "action": {
      "executed": false,
      "execution_receipt": null,
      "external": false
    },
    "approval_roles": [
      "service-owner",
      "rights-reviewer"
    ],
    "decision_cutoff": "2026-05-31T17:00:00Z",
    "decision_id": "decision-public-001",
    "override": null,
    "rationale": "The bounded pilot is reversible, evaluation-ready, and preserves human authority and appeal.",
    "rationale_recorded_at": "2026-05-31T16:40:00Z",
    "rationale_source_ids": [
      "src-service-baseline",
      "src-rights-review",
      "src-pilot-eval",
      "src-community-input"
    ],
    "recorded_at": "2026-05-31T16:50:00Z",
    "required_approval_roles": [
      "service-owner",
      "rights-reviewer"
    ],
    "rule_digest": "sha256:740845435842fbbc0ef5dfaf9a74e48a9bf2892816128a64238dc4d0017c2f08",
    "rule_version_id": "rule-public-v1",
    "selected_option_id": "opt-bounded-pilot"
  },
  "decision_rules": [
    {
      "change_control": {
        "locked": true,
        "owner": "decision-governance",
        "prospective_only": true
      },
      "criteria_weights": {
        "affordability": 0.15,
        "evidence": 0.15,
        "fairness": 0.1,
        "resilience": 0.2,